name,address,country
Gerbera Music Agency株式会社,"神田神保町２丁目１１−１５, 住友商事神保町ビル 2階 千代田区 101-0051",JPN
ダイレクト出版株式会社,"中央区安土町２丁目３番１３号, 大阪国際ビルディング １３F 大阪市 541-0052",JPN
株式会社つくもメディカル,緑区あすみが丘８丁目2−２ 千葉市 267-0066,JPN
株式会社デジタルゴリラ,"青葉区中央２丁目２−３０, 日興ビル 4F 仙台市 980-0021",JPN
ペイフォワード株式会社,"栄町３丁目36−１１, 武蔵野サンハイツ久米川 213 東村山市 189-0013",JPN
株式会社YAGO,"三田２丁目１４−５, 610 港区 108-0073",JPN
合同会社コモダス,"梅田1-1-3, 大阪駅前第3ビル 29階 1-1-1号室 大阪市北区 5300001",JPN
キャレット合同会社,"新宿２丁目５−５, 新宿土地建物第11ビル ４F 新宿区 160-0022",JPN
Tomatalk株式会社,"神宮前６丁目２３番４号, 桑野ビル ２階 渋谷区 150-0001",JPN
株式会社SIVA,"京橋３丁目６−１８, 東京建物京橋ビル 2F 中央区 104-0031",JPN
株式会社ハロー,"代官山町１−６, 広田代官山ビル 7F 渋谷区 150-0034",JPN
デザインオトコシ株式会社,"中央区徳井町１丁目１−６, 新居ビル 202 大阪市 540-0025",JPN
株式会社プレジャーデサイン,"日本橋本町３丁目１−６, 日本橋永谷ビル 204号室 中央区 103-0023",JPN
株式会社ラリーズ,"春日１丁目５−３, 春日タウンホーム 1階C号室 文京区 112-0003",JPN
株式会社日本ブレイス,"二番町１１−３, 相互二番町ビルディング別館 7階 千代田区 102-0084",JPN
株式会社ＦＡＮ ＯＵＴ,"内神田２丁目８−８, 中央ビル 1F 千代田区 101-0047",JPN
株式会社きびだんご,北区吉備津１４８１ 岡山市 701-1341,JPN
株式会社 イーエックス・パートナーズ,"神宮前４丁目３−１５, 東京セントラル表参道 421 渋谷区 150-0001",JPN
カシオ計算機株式会社,本町１丁目６番２号 渋谷区 151-8543,JPN
株式会社ゴリラテ,"銀座６丁目２−３, Daiwa銀座アネックス 5F 中央区 104-0061",JPN
株式会社サイバード,"猿楽町１０−１, マンサード代官山 渋谷区 150-0033",JPN
オアシス一宮店,一宮３丁目３−１４ 一宮市 491-0858,JPN
行政書士YTRディア法務事務所,富士見２丁目１６−２４ 鶴ヶ島市 350-2201,JPN
AZUシステム,生野区勝山南２丁目２−２２ 大阪市 544-0021,JPN
かすがい皮膚科,東梅坪町９丁目８番地３ 豊田市 471-0071,JPN
Công Ty Cổ Phần Truyền Thông Sáng Tạo LemonSea,"Số nhà 78 Ngõ 13 Khuất Duy Tiến, Phường Thanh Xuân Bắc, Quận Thanh Xuân, Hà Nội Hà Nội 100000",VNM
3MUS SERVICES AND COMMUNICATIONS COMPANY LIMITED,"17B, 58/1 Trần Vỹ, Mai Dịch, Cau Giay Ha Noi 80000",VNM
CÔNG TY CP TÂN VIỆT,"452 Đường Lý Thường Kiệt, Phường Thị Cầu Bắc Ninh 16000",VNM
Công Ty Tư Vấn Môi Trường Đô Thị Sài Gòn,"18 Đường D2, Phường 25 Bình Thạnh 70000",VNM
CÔNG TY TNHH DỊCH VỤ BẢO VỆ AN NINH TOÀN THẮNG,"Tổ 8, Thôn Phước Tấn, Xã Tân Hòa, Thị xã Phú Mỹ, Tỉnh Bà Rịa -Vũng tàu, Việt Nam Phú Mỹ",VNM
Công ty cổ phần công nghệ du lịch BestPrice,"Tầng 1, Số 57 Trần Quốc Toản, Phường Trần Hưng Đạo, Quận Hoàn Kiếm, Thành phố Hà Nội, Việt Nam Hà Nội 100000",VNM
Innotech Vietnam Corporation,"33 Ba Vì, Phường 4, Quận Tân Bình Hồ Chí Minh 700000",VNM
Công ty cổ phần Dược phẩm Medstand,"Số 18 ngõ 250 Nguyễn Xiển, Hạ Đình, Thanh Xuân, Hà Nội Hà Nội 100000",VNM
CÔNG TY TNHH TRUYỀN THÔNG VÀ QUẢNG CÁO MẶT TRỜI,"4/9 Bạch Đằng, Phường 24, Quận Bình Thạnh Hồ Chi Minh 700000",VNM
Công ty cổ phần xuất nhập khẩu thương mại và đầu tư sản xuất Tâm Việt,"số 10 ngõ 63 phố Bình Khang, phường Ninh Khánh, thành phố Ninh Bình, tỉnh Ninh Bình, Việt Nam ninh binh 430000",VNM
Công Ty TNHH Dịch Vụ Bảo Vệ Thái Long Sài Gòn,"43 Đường 84 Cao Lổ, Phường 4, Quận 8 Hồ Chí Minh 700000",VNM
CÔNG TY CỔ PHẦN CÔNG NGHỆ DATALYTIS,"Lầu 1, H3 Building, 384 Hoàng Diệu Hồ Chí Minh 700000",VNM
HAI DAT HTC TRANSPORT SERVICE COMPANY LIMITED,"Thôn An Đồng, Xã Quỳnh Hoàng, Huyện Quỳnh Phụ Tỉnh Thái Bình 410000",VNM
CÔNG TY TNHH TRUNG TÂM TƯ VẤN LÁI XE AN NINH,"29/145 Tổ 17, Khu Phố 3, Phường Tân Mai, Thành phố Biên Hoà, Tỉnh Đồng Nai, Việt Nam Biên Hoà 76000",VNM
"Bumbii Technology Co., Ltd","32/8 Street No. 12, Truong Tho Ward Thu Duc 700000",VNM
CÔNG TY CỔ PHẦN PHÁT TRIỂN CÔNG NGHIỆ SÀI GÒN WEB,"38/28 Đường HT37, Phường Hiệp Thành Quận 12 700000",VNM
Nguyễn Thị Kim Loan,"44 Đường số 2, KCN Sóng Thần, An Bình, Dĩ An, Bình Dương Dĩ An 820000",VNM
Tạ Nguyên Ngọc,"Mỹ Thành, Mỹ Lộc, Thôn Phấn Đài Nam Định 420000",VNM
CÔNG TY TNHH GIẢI PHÁP CÔNG NGHỆ EASY ALO,566 Nguyễn Thái Sơn Gò Vấp,VNM
Hộ kinh doanh Nguyễn Thanh Tùng,"Khu 5, Xã Hiền Lương, Huyện Hạ Hòa Việt Trì 35000",VNM
Báo Công Thương,"655 Phạm Văn Đồng, Bắc Từ Liêm, Hà Nội, Tầng 10,11 tòa nhà làm việc Bộ Công Thương Hà Nội 100000",VNM
NGUYỄN KIM NGÂN,"Số 504, QL1 Phường 4, Tân An, Long An Số 504, QL1 Phường 4, Tân An, Long An 81000",VNM
CÔNG TY CỔ PHẦN ĐẦU TƯ ĐỊA ỐC WORLD LAND,"Số 30A3, đường Trần Văn Trà, KDC Hưng Phú 1, Phường Hưng Phú, Quận Cái Răng, Thành phố Cần Thơ, Việt Nam, ( Vui lòng liên hệ 0789 196 916 - Chúng tôi có gửi phí ) Cần Thơ 900930",VNM
Cty CP Vận Tải & DVDL Thuận Thành,36 Ngô Gia Tự Đà Nẵng 550000,VNM
Đồ tốt 247,"Đường Trần Phú, Tổ dân phố Nam Viêm, phường Nam Viêm, Thành phố Phúc Yên, tỉnh Vĩnh Phúc, Đường Trần Phú, Tổ dân phố Nam Viêm, phường Nam Viêm, Thành phố Phúc Yên, tỉnh Vĩnh Phúc Phúc Yên 280000",VNM
MosaCrea Limited,"Bayfield Building, 2301, 23F, 99 Hennessy Rd 灣仔",HKG
Broaden Limited,"30 SHING YIP STREET,, Unit 2, 9/F, WINFUL CENTRE, 觀塘",HKG
JYF INTERNATIONAL,"MS06, 13A/F., South Tower, World Finance Centre, Harbour City, 17 Canton Road 大潭",HKG
Q P Printing Limited,"21/F, Kings Wing Plaza 2, No. 1 On Kwan Street, Shek Mun 沙田",HKG
E-Buy Global Limited,"16/F, 9 Wing Hong Street 長沙灣",HKG
Inform Advertising Company Limited,"Unit A:1069-1071, 10/F., New East Sun Ind Bldg,, 18 Shing Yip Street Street, 觀塘",HKG
TAKUMIYA HOMPO LTD,"建榮街, 建榮商業大廈, 2樓219 屯門",HKG
Polette Ltd,"26 F, 39 Queen's Road Central 中環",HKG
BACO. Group Ltd.,"5 Canton Road, Ocean Centre, Harbour City,, Suite 1126, 11th Floor, 尖沙咀",HKG
something big technology company limited,RM 1501 15/F PROSPERITY TWR 39 QUEEN'S RD CENTRAL HK 上環,HKG
Opportunity Hong Kong Limited,"Woon Lee Commercial Building, 7-9 Austin Avenue 尖沙咀",HKG
Rocketbots Limited,"Room 702 7/F, Fu Fai Commercial Centre, 27 Hiller St 上環",HKG
Electropolis LTD,"Room No.1003, 10th Floor, 1st Building,, Lipper Center, No. 89 Queensway 金鐘",HKG
GS1 Hong Kong Limited,160 Gloucester Rd 灣仔,HKG
NS Technology Limited,"Office G, 37/F, COS Centre, 56 Tsun Yip Street, Kwun Tong, Hong Kong",HKG
Television Broadcasts Limited,"19/F, Leighton Ctr, 77 Leighton Rd",HKG
Willing Media Company Limited,"德輔道中84-86號, 章記大廈12樓全層 中環",HKG
Trend Shopping Global Ltd.,"Unit A, 14/F., Hua Chiao Commercial Centre,No.678 Nathan Road 旺角",HKG
Trade Anywhere Ltd,"Unit A, 5/F, V Ga Building, 532 Castle Peak Road 荔枝角",HKG
Hong Kong Internet Registration Corporation Limited,"Cyberport Road, 3, 100號 Unit 501, Level 5, Core C, Cyberport 薄扶林",HKG
30 Second Explainer Videos Ltd,"30 Second Explainer Videos Ltd, Room 701, On Lok Yuen Building, 中環",HKG
Hongkong youzhiyou Technology Holdings Limited,"UNIT 3A-8,12/F KAISER CTR NO18 CENTRE ST SAI YING PUN HONG KONG",HKG
"Hong Kong Ke Mo software Co., Limited","9/F., MW Tower, No. 111 Bonham Strand 上環",HKG
"Hong Kong Ke Mo software Co., Limited","9/F., MW Tower, No.111 Bonham Strand 上環",HKG
唐足,"荷李活道29號, 地庫 中環",HKG
PLURIA S.A.S.,"CL 59, A BIS 5 13 AP 303 Bogotá, D.C. 145100",COL
MAREAUTO COLOMBIA SAS,"Calle 98 #7091, Piso 14 Bogotá 111121",COL
Creativa Publicidad de Colombia SAS,"Calle 28 Sur No. 51 39, Cundinamarca Bogota 111621",COL
INVERSIONES SPERO SAS,"Calle 145 #19-38, Oficina 304 Bogotá 110121",COL
LUISA CHIMA SAS,CR 80C 19A 12 - cr 80c 19a 14 Medellin,COL
Espitaleta Espitaleta Liliana del Carmen,CARRERA 4 # 47-20 MARBELLA EDIF MARBELLA 47 APTO 1109 Cartagena de Indias 130001,COL
MOSQUERA MARIN JHON ALEXANDER,"Calle 49 D D No. 81 C 65, MEdellin medellin 50022",COL
Gran Panda SAS,Carrera 8 #95-33 Bogotá 110221,COL
YR MUSIC,"Carrera 16 #7920, OF 215 Bogotá 111051",COL
aproelec,cra 27 7 42 bogota 111000,COL
JENNIFER VERA,"Calle 134 #7-83, CS 332 Bogotá 110121",COL
Juan Felipe Rodríguez Gómez,CR 14 # 70 B 21 SUR Bogotá 80411,COL
Juan Carlos Guzman Chaves,"Carrera 21A 12-36, Risaralda Dosquebradas 661001",COL
IMAGENES DIAGNOSTICAS TEUSA S.A.S.,"CR 24 53 73, LC 217 218 219 CC PLAZA 54 Bogotá 111131",COL
Camila Andrea Cuellar Bejarano,"Calle 69 #5-32, 501 Bogotá 110221",COL
RED FORESTAL SAS,"Calle 6c #82a-57, Torre 3 Apartamento 808 Bogotá 110821",COL
SEX ON,"Calle 35 # 36 - 21, Torre 1, Apto 403 Florida del Country Floridablanca 681002",COL
Lanny Zerpa,"Carrera 105 #645, Apartamento 202 Bogotá 111041",COL
TecniServ,"Caracoles mz 73 lt 18, LOCAL 201 Cartagena de Indias 130015",COL
LOGYCA / ASOCIACIÓN,"Avenida El Dorado 92 – 32 Modulo, Módulo 5, piso 5 Bogotá 111071",COL
MAMRE PROMOTORA DE SEGUROS Y SERVICIOS INMOBILIARIOS LIMITADA,"Carrera 54 #106-18, OFI 213 Bogotá 111111",COL
Inversiones Garcia & Garcias S.A.S,Lote 2 Vereda El Pilón Girón 687541,COL
Jeisson Fernandez Miranda,CALLE 48 A #3A2-9 BARRANQUILLA 80020,COL
Doomo Online,"Carrera 100 #23h-83, Casa 8 Bogotá 110911",COL
MG FAST PLOTTER SAS,Carrera 8c #1616 Bogotá 110131,COL
ТОВ «МЕЖИРІЧЕНСЬКИЙ ГЗК»,"вул. Шевченка, 1-А смт. Іршанськ 12110",UKR
"ТОВ ВП МАРІО""""","Сосонське шосе, 4-В Літин 22300",UKR
ТОВ АЛТЕК,"вулиця Саксаганського, 26/26 Київ 1033",UKR
ЕЗРА КОНСАЛТИНГ ГРУП,"ул. Курчатова, 10, оф. 621 Днепр 49038",UKR
ТОВ «МЕЖИРІЧЕНСЬКИЙ ГЗК»,"вул. Шевченка, 1-А смт. Іршанськ 12110",UKR
ТОВ “АЙЛАІН”,"вул.Пушиної Феодори, будинок 30/32, поверх 4 Київ 3115",UKR
ТОВ !ФЕСТ КОФІ МІШН,"Горбачевського, 15 Львів 79044",UKR
ТОВ «МІ СЕРВІС»,"вул. Дегтярівська, буд. 49, к. 27 Київ 3113",UKR
ТОВ Техніка,Єременко буд.2 кв.18 Новоград-Волинський 11708,UKR
Блеск,Янтарна 32/2 Дніпро 49024,UKR
"ТОВ Прінцес Даймонд""""","вул. Вадима Гетьмана, 1 Київ 3057",UKR
"ТОВ Леонтьев""""","Чоколівський бульвар, 27 Київ 2000",UKR
ТОВ «ВІКЛІН»,"вул. Бутлерова Академіка, будинок 1 Київ 2090",UKR
"ТОВАРИСТВО З ОБМЕЖЕНОЮ ВІДПОВІДАЛЬНІСТЮ ВЕБПРОМО""""","вул.Прирічна,, буд. 1А,кв.60 м.Київ 4213",UKR
"ОВАРИСТВО З ОБМЕЖЕНОЮ ВІДПОВІДАЛЬНІСТЮ Грін Го""""","вул.Молодогвардійська,32 Київ 3151",UKR
"ТОВ АЙ ПЛЕЙС ДІДЖИТАЛ""""","Вулиця Болсуновська, будинок 8 Київ 1014",UKR
"ТЕХБУДМЕХАНІКА, ТОВ","м. Київ, вул. Кудряшова, 3а м. Київ 3035",UKR
"ТОВАРИСТВО З ОБМЕЖЕНОЮ ВІДПОВІДАЛЬНІСТЮ МАРКЕТИНГОВЕ АГЕНТСТВО ""СЕЙЛЗ АП""""",Військбуд 99 Запоріжжя 69061,UKR
Товариство з обмеженою відповідальністю “ПРИВАТ КЛІНІК”,"ул. Дарвина, 8/10 Харьков 61002",UKR
"Приватне підприємство ТРІА""""","Повітрофлотський проспект, 47 Київ 3151",UKR
Товариство з обмеженою відповідальністю «ТіБіДабл’юЕй Україна»,"вулиця Рибальська, 22 Київ 1011",UKR
"ДП «ССМ», Філія «Старком» ДП «ССМ»","вул. Лейпцизька, 15 Київ 1015",UKR
Бизнес-тренер Людмила Пенцак,"просп. Молодежи 11, 25 Луцк 43000",UKR
"ТОВ ВКФ СПЕЦПРОМ-КР""""","вул. Комерційна, буд. 6,, кв.18 Кривий Ріг 50000",UKR
"ТОВ ОСА-ГО.ЮА""""","проспект Академіка Глушка, 29 Одеса 65104",UKR
Xfers Indonesia Teknologi,"Jl. DR Ide Anak Agung Gde Agung, Kuningan Timur, Setiabudi, Menara Prima Jakarta Selatan 12950",IDN
PT Komunitas Karya Transformasi,"Jl. Daan Mogon No. 6, Wijaya Kusuma, Grogol, Petamburan, Jakarta Barat, DKI Jakarta, Gedung IKM Lt. 3 JAKARTA BARAT 11850",IDN
PT TERRA ASRI INDONESIA,"Jl Dr Ide Anak Gde Agung Lot D, #17-07 World Capital Tower Jakarta 12950",IDN
PT Integrasi Pemikiran Investasi,"Jl. Wahid Hasyim No.10D, Domisili.id Jakarta Pusat 10340",IDN
PT. Widodo Makmur Perkasa,"Graha Widodo Makmur, Jl Raya Cilangkap No 58 RT 7 RW 3, Cipayung Jakarta Timur 13870",IDN
PT Oasis Waters International,Jalan Rawa Sumur Barat No. 1 Kawasan Industri Pulo Gadung Jakarta Timur 11050,IDN
PT Smart Sinergi Indonesia,"Jalan Jetis, Karyorejan Nomor 9 RT. 000 RW Wedomartani, Ngemplak Kab. Sleman 55571",IDN
PT. Limajari Interbhuana,Jalan Raya Kerobokan 100x Kerobokan 80361,IDN
PT FEEDLOOP GLOBAL TEKNOLOGI,Jl Karang Tinggal no 31 Bandung 40162,IDN
PT Kubus Inovasi Agranara,"Jalan Ir. H. Juanda 48, Citarum, Bandung Wetan, Citarum Bandung Wetan, Citarum, Bandung Wetan Bandung 40115",IDN
PT. GINTA JASMININDO LOGISTICS,Jl. Terusan Bung Hatta Monjok Mataram 83122,IDN
PT Seatech Infosys,"MENARA KADIN JL.HR RASUNA SAID BLK NO.X-5 KAV 2-3 KUNINGAN TIMUR, SETIABUDI, Kel. Kuningan Timur, Kec. Setiabudi, LT.18 UNIT BCD Jakarta Selatan 12950",IDN
PT. Mobil Satu Asia,"Wisma Mampang, 5th Floor, Jln. Mampang Prapatan No. 1 Jakarta Selatan 12790",IDN
PT Media Pemersatu Nusantara,"Jalan Raya Cirendeu 5b, Ruko Autos Tangerang Selatan 15419",IDN
PT. MENARA SINAR TIMUR,"Jl. Raya Dadap No. 24, Kel. Dadap Kec. Kosambi Kab. Tangerang 15211",IDN
Trans Avia,"Jl. Basuki Rahmat No. 80, Kelurahan Jajar, Kecamatan Laweyan Surakarta 57144",IDN
PT Bisma Internusa Jaya Abadi,Jl Bisma ubud 80571,IDN
PT Personalized Business Solutions,"Rukan Sedayu Square Blok E 19, Cengkareng Barat, Jakarta Barat Jakarta 11730",IDN
Wahyu Nurrohman,Desa Sukajawa Kecamatan Bumiratu Nuban Kabupaten Lampung Tengah Lampung Tengah 34160,IDN
cv herlita digital sejahtera,bae Rt 3/5 Kudus Kudus 59317,IDN
PT Ratna Media Utama,"Gedung Tripleso Lt. 3, Jl. Mampang Prapatan Raya No.73A, RT.2/RW.1, Tegal Parang, Kec. Mampang Prapatan (Samping Hotel Maharani) Jakarta Selatan 12790",IDN
CV Palma Nusantara Sejahtera,"Jalan E No.23A Kelapa Dua, Kebon Jeruk Jakarta Barat 11550",IDN
Yesi Setiawati,"Perumahan Menara laswi No.88L, Alkayco Production bandung 40375",IDN
Ni Nyoman rini,Jalan gunung agung Denpasar bali Denpasar 80117,IDN
SMP MUHAMMADIYAH 2 CILACAP,"Jl. DAMAR NO.14 RT 01 RW 09, TRITIHKULON, CILACAP UTARA CILACAP 53233",IDN
บริษัท ไอ โซลูชั่น เซอร์วิส จำกัด,"111/123 หมู่บ้านภัทรโมทาวน์ (โครงการภัทร พาร์ค), ต.บางพูด อ.ปากเกร็ด 11120",THA
ห้างหุ้นส่วนจำกัด ธเนตรมอเตอร์,เลขที่ 127 ถ.หายโศรก ต.ในเมือง อ.เมือง จ.ร้อยเอ็ด เมืองร้อยเอ็ด 45000,THA
หจก.ไทยพัฒนสิน แมชชีนทูลส์,"246, 248, 250 ถนนกาญจนาภิเษก, แขวงบางแค เขตบางแค กรุงเทพฯ 10160",THA
บริษัท ไบร์ท มีเดีย คอร์ปอเรชั่น จำกัด,"410/87-88 ซ.รัชดาภิเษก 22, ถนนรัชดาภิเษก เขตห้วยขวาง 10310",THA
TYK Filters,"180/1 Moo 8 Suksawat 74, Prapadang 10130",THA
บริษัท ดิ เอนชานเตอร์ จำกัด,85/1-3 หมู่ที่5 ถนนราชพฤกษ์ รัตนาธิเบศร์ เมืองนนทบุรี 11000,THA
Yinyang Clinic,"999/1 Ratchada-Ramintra,rd. Klongkum, Buengkum Bangkok 10230",THA
บริษัท วิคเตอร์ บิลเล็ต จำกัด,"206/47 Soi Phatthanakan 20, Phatthanakan Road Suan Luang 10250",THA
บริษัท เคเคเค กรุ๊ป จำกัด,3 ซ.เพชรเกษม 98/1 ถ.เพชรเกษม บางแค 10160,THA
The Secret Farm,"บริษัท เดอะ ซีเคร็ต ฟาร์ม จำกัด (สำนักงานใหญ่) 1679/2, หมู่บ้าน ทาวน์ อิน ทาวน์ ซ.ลาดพร้าว 94 (ปัญจมิตร) แขวงพลับพลา เขตวังทองหลาง 10310",THA
บริษัท ซูซูกิ นวนคร จากัด,31/7 หมู่ที่13 ถนนพหลโยธิน ตำบลคลองหนึ่ง อำเภอคลองหลวง 12120,THA
Varna International,223/10 Moo 6 Bophut Koh Samui 84140,THA
บริษัท แอด ฟาสท์ อินโนเวชั่น จำกัด,200 ประชาราษฎร์ Mueang Nonthaburi 11000,THA
"Fukushima Galilei (Thailand) Co., Ltd.","16 อโศก คอร์ท ชั้น จี ห้อง 2 จี, ถนนสุขุมวิท 21(อโศก) วัฒนา 10110",THA
"Kongthep Company, Ltd.","99/4 Moo 7, Mangosteen Ayurveda & Wellness Resort Phuket 83130",THA
We Du,95 เมืองลำปาง 52100,THA
บริษัท ดับบลิวเอสเจ คอมเมิร์ซ จำกัด,74/1 ซอยพหลโยธิน 54/1 แยก4(วัดเกาะ) แขวงสายไหม เขตสายไหม กรุงเทพมหานคร 10220 สายไหม 10220,THA
ห้างหุ้นส่วนจำกัด เจริญชัย ออโต้พาร์ท,59 ถนน รัชดาภิเษก กรุงเทพมหานคร 10310,THA
Ltman Company Limited,"518/5 Maneeya Center Building 7th Floor, Ploenchit Road, Lumpini, Patumwan, Bangkok 10330",THA
Wingwow Limited,"18/370 Mu Ban Rarm Intra 71 Project 1 Alley, Bang khen 10220",THA
เด็นทัลพอยท์ คลินิกทันตกรรม สาขา 2,"153 หมู่9, เพนียดช้าง 8 บางละมุง 20150",THA
Thaicoffeeservice,68/1 Moo 4 Chiang Rak-Yai Sub-district Samkhok District 12160,THA
บริษัท แท็บ มีเดีย โซลูชั่นส์ จํากัด,"99/48 Chomplern River Loft Village, Moo 3, Rattanathibet Nonthaburi 11000",THA
เคสสกรีนออกแบบเองได้,"25, ลาดกะบัง จตุจักร 10100",THA
บริษัท อาร์คีลอน คอร์ป จำกัด (สำนักงานใหญ่),"2035/1 ซอยสุขุมวิท 77/1, ถนนสุขุมวิท เขตวัฒนา 10110",THA
IRENE COUNTRY LODGE (PTY) LTD,"Nelmapuis Drive, Irene Estate Pretoria 68",ZAF
Triple Double Media,81 Berg Street Johannesburg South 2190,ZAF
G2G Projects (Pty) Ltd,"Hornbill Road, 80 Reve de Provence Johannesburg 2191",ZAF
SOUTH AGRO EXPORTS,"27 Blyde road, Farrarmere Benoni, 27 Blyde road, Farrarmere Benoni Benoni 2000",ZAF
The Kiddie Co,"84 Voortrekker Ave, Johannesburg 1609",ZAF
ELECTRIC EGG PTY LTD,"16 Electron Street, Datavoice House Stellenbosch 7600",ZAF
Pinnacle Online (Pty) Ltd,"7 Crocker Road, Unit 1 Wadeville Worx Germiston 1428",ZAF
Dixoplex Pty (Ltd),459 section 3 Cape Town 7655,ZAF
SWELL DIGITAL Pty LTD,3 Ian Close Cape Town 7806,ZAF
Peter Machlup Fine Wristwatches (Pty) Ltd,1 River Street Johannesburg 2198,ZAF
Emesco Holdings (Pty) Ltd,"Corner of Olivenhoutbosch & Jean Avenue, Byls Bridge Office Park Centurion 157",ZAF
Elevate Rentals (Pty) Ltd,"4 Arterial Road West, 4 Germiston 2007",ZAF
CVLT,33 Homestead Road Sandton 2128,ZAF
Tkbean IT Solutions,"14th road, 58 Fountain View Midrand 1684",ZAF
Ma Mere Confections (Pty) Ltd,5 Loop Street Cape Town 7405,ZAF
keneo waste management and logistics (PTY) Ltd,4985 Modimolle Crescent Embalenhle 2285,ZAF
Cre8tive Solutions,"Unit 84, Deo Favere, Complex,, 357 Parsley Avenue Pretoria 182",ZAF
1st Canadian Visa,16 Vondel Road Cape Town 7441,ZAF
VitaminMe (Pty) Ltd,32 Fricker Road Sandton 2196,ZAF
BRBD Pty Ltd,"1 Reunion Drive, 133 Plovers Nest, Somerset Lakes Cape Town 7130",ZAF
Warehouse Finder,"Building 3, 34 Culross road, Bryanston Johannesburg 2191",ZAF
i-Arc cc,38 KUDU ROAD Ballito 4399,ZAF
Akhanani Logistics Pty Limited,"30, Cottonwood Road Port Elizabeth 6065",ZAF
Greenz Drainage,43 Killarney Avenue Cape Town 7441,ZAF
The Artist Edge - Trading as The Deckle Edge,13 Brickfield Road Cape Town 7925,ZAF
Health Plus World Medical Adviser LTD,Kiryat Hadassah 1 Ein Kerem Jerusalem 12290,ISR
"קרנות סוכנות לביטוח פנסיוני )2020( בעמ""",בולטימור עכו,ISR
"א.ב. המרכז הישראלי לעובדים זרים בעמ""",ויצמן 60 כפר סבא 4425029,ISR
EKB Technologies Ltd,"Hadadi St, 2/2 Bat Yam 5951301",ISR
ALL ART it Technology Ltd,"החרושת 6, מבנה תעשייתי נשר 3688106",ISR
Ela Expeditions Ltd.,"12 Sderot Yehudit, 1 Tel Aviv 6701614",ISR
CloudAlly Ltd,13 Zarhin Street Raanana 11111,ISR
"טרפיקו בעמ""",po box 14554 tel aviv 61144,ISR
Foxy Media Ltd,Menachem begin 37 Tel Aviv 6652612,ISR
AIR DOCTOR LTD,"Hashaked, 1 Beit Nekofa 9083000",ISR
Neclid,Hagdud Haivri 5 Ashdod 7745511,ISR
כהן יואב,"האלונים 11, דירה 4 מוצא עילית 9082000",ISR
"יעקב כהן, עוד ומגשר""","חרמון 4, 20 אור יהודה 6041909",ISR
SD INVEST LTD,184 a hanassi ben ytzhak ben zvi Hertzelya 6100000,ISR
Liron Cohen,Reichan 8 Hadera 3849251,ISR
לגנסקי בית להופעות בע״מ,"הרצל 31, מרתף נתניה 4239004",ISR
Tapuznet LTD,זרחין 10 Ra'anana 4366238,ISR
ערן לוי אגמי,"אלעד, שמעיה אלעד 48000",ISR
Faitex Furniture and Fabrics,Yeffet 185 Jaffa 6329302,ISR
דוטקום ישראל,שדרות סיני 20 חיפה 3433207,ISR
פטקין אלכסנדר,"Pal-Yam 16, floor 2 Haifa 3309523",ISR
סקובה השקעות בע״מ,dreh yafo 2 Tel aviv 6609101,ISR
ניצן סויסה שיר יזמות,אורי צבי גרינברג 17 תל אביב,ISR
Justt Fintech Ltd,10 Ibn Gabirol Street Tel Aviv 6407712,ISR
"עוד רן סיון""",בית השיטה בית השיטה 1080100,ISR
Почивка БГ ООД,Ул. Константин Фотинов 44А Бургас 8000,BGR
НаВън ЕООД,бул. Симеоновско шосе 212 София 1434,BGR
Smarkethink Ltd,Калиманци 21 София 1505,BGR
Skyshop Bulgaria Ltd.,"251 Okolovrasten pat blvd., Ring Tower, fl.6 Sofia 1715",BGR
ВИ КЛИМА ЕООД,жк. Тракия бл.100 вх. Ж Пловдив 4000,BGR
Roi Art ltd.,"679 str., 11 Sofia 1618",BGR
GL GRUP 2015 LTD,Vasil Levski 36 Dryanovo 5370,BGR
Glezko LTD,"ж.к. Захарна фабрика, бл. 126, вх. Б, ет. 4, ап. 16, бл. 126, вх. Б, ет. 4, ап. 16 софия 1345",BGR
Грийн Поинт ООД,"ул. Деян Белишки № 40-42, ет. 7, ап. 18 жк Гоце Делчев / Gotse Delchev 1404",BGR
Лингва клас ООД,"ул. \Граф Игнатиев\"" № 5",BGR
МИ ТРЕЙД Груп ЕООД,"София, бул. Джавахарлал Неру 29 София 1336",BGR
"ФЛОРАВИТ"" ООД""","ул. \Велико Търново\"" 1 Пловдив 4000""",BGR
Нутракорп ЕООД,"бул. Иван Иванов 70Б, 3 София 1303",BGR
Термо Проект Комерсиал ООД,"24та, №19А с. Бенковски 4201",BGR
АКВА ТУР БГ ЕООД,"ул. Здраве 9, ет.1, офис 3 София 1000",BGR
Фешън Зона БГ ООД,"гр.София, ж.к. \Манастирски ливади\""",BGR
Мертекс София ЕООД,"Йосиф Щросмайер, Бл 203 София 1233",BGR
Реми Делукс ЕООД,УЛ. ПАНАЙОТ ВОЛОВ 15 Войводиново 4135,BGR
Веко Пауър България ООД,"ж.к. Мусагеница, р-н Младост, бл.90, вх.7, ет.1, ап.114 София 1797",BGR
AFI Lagera Tulip EOOD,"Dobrotitsa Despot str, block 41, entrance G /building B4/, ground floor Sofia 1612",BGR
Вайръл Маркетинг ЕООД,"ж.к. Суха река, бл. 214А, ет. 12, ап. 54, 54 София 1505",BGR
Митева Груп ЕООД,Str.Pere Toshev 32 Plovdiv 4000,BGR
