name,address,country
БулСмарт ООД,"21 Luis Eyer str., Sofia 1404 Sofia 1404",BGR
Сомниум ЕООД,"Simeon Radev Str. 27A, 14 София 1618",BGR
Рубикон Бетон ЕООД,ул. Младежка 20 Съединение 4190,BGR
ONE POINT TOURISM LLC,"Dubai, Dubai",ARE
Carian Ltd,"Office No 56, Building No Z3, Saif Suite",ARE
EV REAL ESTATE BROKERAGE L.L.C,"Palm Jumeirah, Golden Mile 1, Building 2, Mezzanine Level, Office 21",ARE
Al Amal Readymade Garments Workshop LLC,"3, Industrial Area 1, Ajman",ARE
Executive Cargo Packaging LLC,P.O.Box.185213,ARE
Get Out There FZE,Fujairah Creative Tower,ARE
Rona Rabah Dental Clinic,"Dubai Business BAY Burlington tower office 111, office 1c1 111",ARE
NOUR AL AMAL LOCKS & KEYS TRADING L.L.C,Hor Al Anz Street,ARE
ALTAF BASHIR TECHNICAL SERVICES,"M-12b Al khabeesi area deira Dubai UAE, Deira Dubai UAE",ARE
AL HAFAREEN TECHNICAL SERVICES CONTRACTING L.L.C,Al Barsha South - Prime Business Center,ARE
Seventh-day Adventist Church,SDA compound Ras Al Khaimah,ARE
شركة الفراعنة لإدارة العقارات والصيانه العامه,ابوظبي مدينة خليفه الامارات العربية المتحدة,ARE
SNTTS INVESTMENT L L C,"Al Qusais Second M 02 09, COASTAL BLDG 65 0",ARE
فلكسبل هاند للصيانة العامة,"Mussafah M45, Street No9",ARE
noor al fadha used furniture tr,"al qasimia, near qasar al sham restaurant",ARE
Abjad Vehicles Recovery,"Dubai, Dubai",ARE
DIGITANTRA FZC,"1 UAQ FTZ BUILDING, UAQ",ARE
ASD B&T Co FZE,Smart Desk 401-11- TEC,ARE
Memuvo DMCC,"MBL Residence, Retail 01, Cluster K, Jumeirah Lakes Towers",ARE
Adin technologies llc,"Dubai, Aspin commercial tower",ARE
Fixperts Contracting LLC,"Jumeirah Village Circle, Prime Business center",ARE
Aloud Properties,E504-ALshoala Building -Port saed-Deira-Dubai,ARE
Silent Theme Production FZE LLC,"A-0059-448 - Flamingo Villas, Ajman License Address المدير",ARE
PROTON MOBILE FZE,"Al Shmoohk Business Center, One UAQ",ARE
Makynat Alshr Electric household,"Dubai, Dubai",ARE
Valtek S.A.,"av marathon 1943, Ñuñoa",CHL
TE TREGUEAR LTDA,"Madamme Bolland, 519 La Cisterna 7980634",CHL
CENTRO DE ERGONOMIA Y SALUD OCUPACIONAL CESO SPA,"Arturo Prat 199, torre a oficina 1209 Concepción 4030000",CHL
Proyecto de Seguridad Industrial y Turismo Vallhala Spa,"Avenida Providencia 2237, Local P65 Providencia 7510089",CHL
Ad Audiovisual Y Diseño Spa,"Avenida Nueva Providencia 1208, 1603 Providencia 7500571",CHL
Prestación de Servicios Yogaurbano Ltda,"Avenida Providencia 1650, 710 Providencia 7500027",CHL
Pontificia Universidad Católica de Chile,"Avda. Vicuña Mackenna 4860, Macul Macul 7820436",CHL
cobrexchile Spa,"calle el sauce 332, villa las aralias Padre Hurtado 9710000",CHL
Zabaleta y Compañía SpA,"Paseo Ahumada 254, of. 808 Santiago 1030000",CHL
Assurance Group Chile SpA,"Avenida Ventisquero 1204, Bodega 93, 93 Renca 8640193",CHL
BIUTIKA SPA,"LOS DOMINICOS 8630, 709 Las Condes 7571892",CHL
Equipaje Urbano Chile S.p.A.,"Santa Lucia 330, 1 Santiago 8320000",CHL
ODONTOESTETICA LAS LOICAS SPA,Pasaje Las Loicas 4129 Coquimbo 1780000,CHL
Jardin Austral Spa,"Los laures o75, isla teja, piso 2 Valdivia 5110026",CHL
Sergio Esteban López Medina,Manzanilla 0427 Colina 9351907,CHL
Sociedad Sabino,Calle Huemul Puerto Varas 5550000,CHL
Clean Expert Limpieza Integral SpA,"Avenida Américo Vespucio 301, Oficina 301-02 Conchalí 8560027",CHL
Consultora G7 SPA,Diego de Velásquez 2079 Providencia 7500000,CHL
MG Comunicación Global Limitada,"Avenida Presidente Kennedy 7500, Oficina 303 Vitacura 7650618",CHL
TECNOLOGÍAS SALUDANDO SpA,"El Bosque Norte 500, 1102 Las Condes 7500000",CHL
O3 Comunicaciones,9 norte 1288 Talca,CHL
Eco Fusion Spa,"Vital Apoquindo 1690 Blok A9 dpto 305, blok a9 dpto 305 Las Condes 7600622",CHL
Procesadora WB spa,"Coronel de la Quintana 343, Independencia Independencia 8380000",CHL
PopCorp SpA,"Santa Victoria 562, 204 Santiago 8330394",CHL
RF CAPITAL SPA,"Apoquindo 7935, Torre A, 301 Las Condes 7550000",CHL
ΙΩΑΝΝΗΣ ΝΤΙΝΑΣ,"ΘΟΥΚΥΔΙΔΟΥ 45, ΑΓΙΟΣ ΔΗΜΗΤΡΙΟΣ ΑΘΗΝΑ 17343",GRC
ΚΟΥΝΤΟΥΡΟΥΔΗ ΑΝΑΣΤΑΣΙΑ,18 ΧΙΛ ΘΕΣΝΙΚΗΣ ΜΟΥΔΑΝΙΩΝ ΘΕΣΗ ΦΑΡΜΑΚΕΙΚΑ ΘΕΡΜΗ 57001,GRC
ANEL A.E,ANAGENNISEOS 20 THESSALONICA 54627,GRC
ΜΟΤΟΔΙΚΤΥΟ Α.Ε.,Germanikís Scholís 10 Marousi 151 23,GRC
ΑΡΙΣΤΕΙΔΗΣ ΤΣΟΥΜΠΟΣ ΚΑΙ ΣΙΑ ΕΕ,Χαριλάου Τρικούπη 3 Ιωάννινα 45332,GRC
DigitalUp IKE,"Voukourestiou 21 and Valaoritou, ATHENS Kolonaki 10671",GRC
ΧΑΣΠ ΕΛΛΑΣ Α.Ε.,"ΙΔΗΣ 6 & ΠΛ.ΕΛΕΥΘ.ΒΕΝΙΖΕΛΟΥ, ΗΡΑΚΛΕΙΟ ΚΡΗΤΗΣ ΗΡΑΚΛΕΙΟ ΚΡΗΤΗΣ 71201",GRC
«ΝΙΚΟΛΑΟΣ ΓΙΑΝΝΑΚΟΠΟΥΛΟΣ Ανώνυμος Εισαγωγική και Εξαγωγική Εταιρεία Μονωτικών και Στεγανοποιητικών Υλικών πάσης φύσεως Α.Ε.,Αγίου Αθανασίου 37 Άνοιξη 14569,GRC
ΚΟΙΝΟΠΡΑΞΙΑ ΠΛΟΙΩΝ ΚΕΡΚΥΡΑΣ (KERKYRA LINES),"ΑΚΤΗ ΜΙΑΟΥΛΗ 25, ΕΛΕΥΘΕΡΙΟΥ ΒΕΝΙΖΕΛΟΥ 46 Α ΠΕΙΡΑΙΑΣ 18535",GRC
Basis Consumables LP,"Kapetan Eukleidi 7, PO 2206 Oraiokastro, Thessaloniki 57013",GRC
ΝΙΚΟΛΑΟΥ ΕΥΑΓΓΕΛΙΑ,"ΑΙΤΩΛΙΚΟΥ 78, ΠΕΙΡΑΙΑΣ ΠΕΙΡΑΙΑΣ 18545",GRC
PC-Bonus,Πατούσα 3 & Σόλωνος Αθήνα 106 77,GRC
ΠΑΠΟΥΤΣΑΝΗΣ ΙΩΑΝΝΗΣ,P. Kountiourioti 47G Mytilene 81100,GRC
ACCESS ABEE,6klm HARILAOU - THERMIS THESSALONIKI 57001,GRC
Σαμαρίδου Σοφία,"ΕΛΑΙΟΧΩΡΙ, ΚΑΒΑΛΑΣ Νέα Πέραμος Καβάλας 64007",GRC
ΒΑΣΙΛΑΚΗΣ,ΒΙΚΤΩΡΟΣ ΟΥΓΚΩ 17 Chania 73132,GRC
Εραλίδη Κυριακή,"Λ.ΑΛΕΞΑΝΔΡΑΣ 2 ΑΘΗΝΑ, Αγιας παρασκευης 149 Αχαρναι Αττικης Αχαρναι 13671",GRC
CH THEATER ΜΟΝΟΠΡΟΣΩΠΗ Ι.Κ.Ε,Βεΐκου 139 Γαλάτσι 11146,GRC
ΦΩΤΕΙΝΟΠΟΥΛΟΣ ΕΥΑΓΓΕΛΟΣ ΚΑΙ ΣΙΑ ΕΕ,Αγίου Γεωργίου 103 ΠΥΡΓΟΣ 27131,GRC
ΣΙΟΝΤΗΣ Ν. ΑΕ,ΒΛΑΧΛΕΙΔΗ ΚΑΙ ΠΟΥΤΕΤΣΗ ΙΩΑΝΝΙΝΑ 45332,GRC
Prime Biosciences P.C.,Lemesou 18 Agios Dimitrios 17341,GRC
Marinopoulos Simvouloi Epixeiriseon S.A,"63, Ag. Dimitriou Street Alimos 17476",GRC
FITNESS AND WELLNESS INNOVATION IKE,"KIFISIAS STREET, KATECHAKI & ADRIANEIOU Athens 11525",GRC
ΜΟΥΣΤΑΚΗΣ ΔΑΛΙΑΝΟΥΔΗΣ ΙΔΙΩΤΙΚΟ ΙΑΤΡΕΙΟ ΙΚΕ,ΑΚΑΔΗΜΙΑΣ 8 ΑΘΗΝΑ 10671,GRC
ΜΑΡΙΑ Γ. ΣΤΑΘΟΥΡΑΚΗ,"ΚΩΝΣΤΑΝΤΙΛΙΕΡΗ 39-43, ΒΥΡΩΝΑΣ ΑΤΤΙΚΗ 16231",GRC
Goldmoney Inc.,334 Adelaide St W #305 Toronto M5V 1R4,CAN
BOUTIQUE MONT-GARCEAU INC.,190b Chem. du Lac Blanc Saint-Donat-de-Montcalm J0T 2C0,CAN
Fulcrum Construction Limited,896 Bessy Trail Milton L9T 0A6,CAN
Peach Marketing Inc,680 Champlain St Dieppe E1A 1P5,CAN
Groupe Financier Stratège inc.,912 Grande Allée O Québec G1S 1C5,CAN
Pacific Coastal College Of Massage Therapy,1152 Mainland St #430 Vancouver V6B 4X2,CAN
Vo's Smart Marketing Inc.,3027 E 29th Ave Vancouver V5R 1V9,CAN
1337843 BC LTD,15355 24 Ave Surrey V4A 2H9,CAN
CLEANBOOK,7-27 Grenadier Ct St. Catharines L2M 4R8,CAN
NOBSCO Inc.,1862 Bathurst St #605 Toronto M5P 3K8,CAN
L2B Inc.,428 Rue des Érables Laurier-Station G0S 1N0,CAN
Monet Brands Inc.,7947 209 St #93 Langley V2Y 0Y6,CAN
Sachin Sharma Productions Inc,190 Forum Dr Unit 55 Mississauga L4Z 3Y2,CAN
Latitude Consulting Inc.,2 Glamis Ave Toronto M6N 4H4,CAN
Save Max Real Estate Inc,6755 Mississauga Rd #304 Mississauga L5N 7Y2,CAN
Jacobs Trading Ye Olde Rock Shop,1600 Regent Ave W Unit 11 Winnipeg R2C 3B5,CAN
9458-9405 Quebec Inc,2540 Bd Daniel-Johnson suite 212 Laval H7T 2S3,CAN
WaveIn Inc operating as ChargeAutomation,20 John St #223 Toronto M5V 0G5,CAN
Government of Prince Edward Island Department of Health and Wellness,11 Kent St Charlottetown C1A 7N8,CAN
McDonough Manufacturing Canada Ltd.,1046 NB-105 Mactaquac E6L 1B3,CAN
14445902 Canada Inc.,33038 Old Riverside Rd Abbotsford V2S 7B3,CAN
Groupe Falco inc. / Intempery,8512 Rue Choquette Saint-Léonard H1R 2Z6,CAN
First Nations Auto Credit,3907-10310 102 St NW Edmonton T5J0K5,CAN
Dr. Shane Seal Institute,8 Rowan St Suite 300 St. John's A1B 2X1,CAN
STEFANIZZI VALUATION & FINANCIAL ADVISORY INC.,207 Northern Ave E Sault Ste. Marie P6B 4H9,CAN
GETRYT TECHNOLOGIES PRIVATE LIMITED,"MGR Nedunchalai, Perungudi Chennai, Kanchipuram District, CeeDeeYes Tyche Tower, Ground Floor No.2 Chennai 600096",IND
Ish Cybersolutions Pvt. Ltd.,"251, Block B, 3rd floor, Rohini New Delhi 110085",IND
imitation world,"kolkota, NORTH MALL 4TH FLOOR KOLKATA 700055",IND
Aqua Care Hi-Tech System,"GROUND FLOOR, NO.16A, SHASTRI NAGAR MAIN ROAD, ADAMBAKKAM CHENNAI 600088",IND
JAISAL TOURS,NEAR FORT ROAD SODHA GROUP JAISALMER JAISALMER 345001,IND
MAYURI KUMKUM LIMITED,"Sr.No.36, H No-12,, Building No.03, Gurukrupa Developers Indl Estate, Waliv Road, Dhumal Nagar, Vasai East, Palghar, Palghar 401208",IND
Fintech IT Solutions LLP,"Software Technology Parks of India, CYB-1, Cyber Park, HIA, Jodhpur Jodhpur 342003",IND
Sahayak Associates,"Plot No. 182/3, Industrial Area, Phase-01 Chandigarh 160002",IND
FACTOTUM TECHNOLOGIES PRIVATE LIMITED,"Second Floor, 5179, HIGH TENTION ROAD SECOND STAGE, VIJAYANAGARA, Mysore 570017",IND
SHIVA SHAKTHI ENTERPRISES,"No 12/69 Paramanandham street, Sevenwells Chennai 600001",IND
SARANG ENTERPRISE,"B-8, ADARSH NAGAR SOCIETY,, VARACHHA, SURAT, Surat 395006",IND
OPOLI TECHNOLOGIES PRIVATE LIMITED,"SCO 213 Sector 40 D, Chandigarh Chandigarh 160036",IND
Eljay Agencies,"I St Floor, Shop No.15,, Rainbow Plaza,, No.68, Purasawalkam High Road,, Chennai., Chennai, Tamil Nadu, 600007 Chennai 600007",IND
Diksha Transport Corporation Packers & Movers,18A Kali Mata Mandir Road Near Cambridge international school Nalapara Guwahati 781034,IND
TECHNOGIQ IT SOLUTIONS PRIVATE LIMITED,E-1/50 Arera Colony Bhopal 462016,IND
Hayaansh Business Enterprise,"5-7-71,GNT Road Sullurpeta 524121",IND
Zoaxy Consulting,"Plot No 512, MAHAVIR NAGAR, MAHABHOI SASAN BHUBANESWAR 751002",IND
Kisalay Commerce Classes Prayagraj (Allahabad),"147-A/1 Tagore Town Near Bansi Bhawan, Allahabad Allahabad 211002",IND
Samskriti Tours & Travels,"Sarvey No.17/1A, Bada Kanshirada Village, , Kogilban road, dandeli 581325",IND
Riseup Infotech,"4, B-403, DEEP KAMAL-2,SARTHANA JAKATNAKA ROAD, NEAR ZOO SARTHANA Surat 395006",IND
Five Online Web Solutions Pvt Ltd.,"Senapati Bapat Marg, B 307, Naman Midtown Mumbai 400013",IND
Shri Badri Hospitalities,"143/3, 143/IP2, Someshwara Agrahara Road, Kukke Subramanya, Dakshina Kannada Kukke Subramnaya 574239",IND
"Om kala sanskritik kendra, halarna, pernem",parabwada Alorna 403503,IND
Ayubal Kart,"c9/63, Rohini sector 8 Rohini 110085",IND
Kabir designer boutique,"B-128c street no. 6 Hardev Puri, Near Indian Bank Shahdara 110093",IND
Timetech Pty Ltd,21/47 Third Ave Blacktown 2148,AUS
Rory Kinsella,15a Lasseter Ave Chifley 2036,AUS
AKT SERVICES SYDNEY,14 Donohue St Kings Park 2148,AUS
Danielle Sancha Ann Klein,1C Kyle St Glenside 5065,AUS
Embody Women,52 Church St Dubbo 2830,AUS
The Leisures Shoe Company PTY LTD,19 Collins Rd St Ives 2075,AUS
F.I.T. TRAVEL AUSTRALIA PTY LTD,19 Cartagena Ln Coombabah 4216,AUS
The Australian Academy of Media,7 Bugle Cct Kellyville 2155,AUS
Notchup Marketing,92 Summerfield Ave Quakers Hill 2763,AUS
Core & Capacity Disability Support,2112/18-38 Main St Beenleigh 4207,AUS
Flexible Supportive Plan Management,2 Longden St Brinsmead 4870,AUS
Webster Electrics Pty Ltd,216 Warragul-Lardner Rd Warragul 3820,AUS
Awakened Soul Productions,62 Hopping Rd Ingleburn 2565,AUS
JRC Professional Bookkeeping,44 The Elms Blvd Kilmore 3764,AUS
SMS Gas Installations,Level 5 63 Pirie Street Adelaide 5000,AUS
Ace gentlemans club,4/27 Ace Cres Tuggerah 2259,AUS
KKA Auto Glass Specialists,42 Essendon St Saint Johns Park 2176,AUS
Rainbow Kids Yoga PTY LTD,670 Wilsons Creek Rd Wilsons Creek 2482,AUS
For the love of Fridays,67 Buchanan Rd Berwick 3806,AUS
Reach Alternatives IM Pty Ltd,level 8/11 York St Sydney 2000,AUS
Car and Metal Field Pty Ltd,281 Princes Hwy Kembla Grange 2526,AUS
advertising agency,SUITE 603/95-99 York St Sydney 2000,AUS
Growth Labs Australia,12 Wentworth St Port Kembla 2505,AUS
Movement Assessment Technologies Pty Lty,1/296 Charman Rd Cheltenham 3192,AUS
Liquid Ascent Investment Trust T/A Skin Spa,2/20 Stewart Rd Ashgrove 4060,AUS
"TOP GAME GROUP, s.r.o.",Povstania 8 Topoľčany 955 01,SVK
"MLongauer, s.r.o.","Farská, 12 Nitra 94901",SVK
Contas s.r.o.,Karpatská 18 Bratislava 811 05,SVK
"Chilli Peppers, s.r.o.","Sasinkova, 48 Piešťany 92101",SVK
"DSI DATA, a. s.",A.Bernolaka 377 Namestovo 2901,SVK
H21 lab s.r.o.,Kopčianska 10 Bratislava 85101,SVK
PROFI one spol. s r.o.,Pluhová 66 Bratislava 83103,SVK
ALTEVITA s.r.o.,nam. Slobody 10 Piestany 92101,SVK
DrevoDed s.r.o.,Trieda SNP 94 Kosice 4011,SVK
flexity s.r.o.,"Luda Zubka 2, 2 Bratislava 84101",SVK
TitanTrading s.r.o.,"Hollého 3, 3 Sabinov 8301",SVK
"Queedo, s.r.o.","Guothova, 15 Bratislava 831 01",SVK
"Somnium, s.r.o.","Romanova, 35 Petržalka 85102",SVK
B-commerce Group s. r. o.,Duklianska 16 Bardejov 085 01,SVK
Health Brands s.r.o.,Dlouhá 132/1 Říčany Praha - východ 251 01,SVK
3KMI s.r.o.,Podjazdová 5 Prievidza 971 01,SVK
"Jewellery SK, s.r.o.",Mozartova 11 Trnava 917 08,SVK
AbsolutSecurity Slovakia s. r. o.,Stará Vajnorská 37 Bratislava - mestská časť Nové Mesto 831 04,SVK
Koloria CZ s.r.o.,"Lidická 700/19, Veveří Brno 60200",SVK
MIPART s.r.o.,Sídlisko 169/49 Tvrdošín 027 44,SVK
"Arvin & Benet, s.r.o.",Záhradnícka 30 Bratislava 821 08,SVK
Juraj Ďurčo Had Trade,"M.R.Stefanika, 48/21 Banovce nad Bebravou 95701",SVK
BERSICOMP s.r.o.,"Bartošovce, 200 Bartošovce 8642",SVK
Zoltán Haris-HZ,Tulipánová 35 Nesvady 94651,SVK
inComputer.sk s.r.o,Blumentálska 2727/19 Bratislava 811 07,SVK
Aska Sykes Ltd,14D Grants Avenue Greenogue Business Park D24 XK54,IRL
Adrenalin Limited,Maiden St Newcastle West,IRL
DDS Architecture Ltd,"Docklands Innovation Park, East Wall Road, Unit 14.1.2 Dublin 3 D03Y0T4",IRL
JH Fitzpatrick Ltd,"New Lodge Cross, Kildare Road Monasterevin W34 TN97",IRL
Adapted Living,"Ballycarron, Golden Cashel E25T625",IRL
Nature's Water Ltd,62-63 Anne Street Dundalk A91 FD45,IRL
Beauty Features Ltd,"Unit 4 Ballywaltrin Busin, Boghall Rd Bray A98 RF25",IRL
BrandAmp Limited,"Lisheen Cross, Ballynacally, Ballynacally, Ballynacally Lisheen Cross V95 WNE2",IRL
FLY media,16 Lioscian Swords K67 HD60,IRL
Oci,"Toureen, Bealadagan Galway",IRL
Solarstream Limited,"Enterprise house, O'Brein Road Carlow Town R93YOY3",IRL
ASOC Innovation Limited,Abbeyfield Farm Clane W91 T384,IRL
"Prevention Is Better, LTD","22 Oak Lawn, Pearse Rd Sligo F91 Y6N4",IRL
Carpenters Kitchens and Bathrooms,Cross Street Kells A82 E2H2,IRL
Declan Fennelly,27 Monastery Heath Green Clondalkin D22 WD29,IRL
Guardwell Lock & Safe Co Ltd,"Unit 8, Link Road Business Park Ballincollig P31 DC58",IRL
Sligo Supply Centre Ltd,Ballast Quay Sligo F91 H6NF,IRL
Wild Atlantic Living,Frances Street Kilrush V15 CH68,IRL
Kilmeric Ltd t/a Lorimat,"Lorimat, 1st Floor 24 Patrick Street Kilkenny R95 FNY8",IRL
patsafelimited,65 Newcastlemanor square Dublin,IRL
Puppets Ireland,Derryclare Summerhill A83 P863,IRL
CARRIGALINE FURNITURE & CARPET CENTRE LIMITED,"Old Pottery Complex, Main Street Carrigaline P43 FF97",IRL
MCG Auto-Styling Limited,Castle Street Kells A82 X433,IRL
Rehabilitation and Performance Initiative Dublin Limited,"Unit 3, Beechlawn Industrial Complex, Greenhills Road Walkinstown D12 XE43",IRL
Borris House Events,Borris House Borris R95 W983,IRL
Matriks Bilgi Dağıtım Hizmetleri A.Ş.,"İZZET PAŞA MAH. YENİ YOL CAD. NO: 3 İÇ KAPI NO: 125, Nurol Tower, Kat:18 Ofis 1808 ŞİŞLİ 34381",TUR
ALTEREGO TURİZM SEYAHAT TİCARET LİMİTED ŞİRKETİ,"Alsancak Mahallesi Atatürk Caddesi, No:336/4 Onart Apt, 35220 Konak/İzmir Konak 35250",TUR
Mustafa Uzun,Atilla Eşer Caddesi 51/a Etimesgut 6794,TUR
Fantom Ayakkabı Tekstil Sanayi ve Ticaret Ltd.Şti.,"Yıldız Mah. Çırağan Cd, No:73/A Beşiktaş 34349",TUR
Ayşe Çayır,soğanlı mah. site sok. no:8/A Bahçelievler 34183,TUR
KERİM MEŞE,"Mahmutbey, istoç, 37. Yol Sk. no : 40, 34218 Bağcılar/İstanbul, Bağcılar / İstanbul / Türkiye Bağcılar 34218",TUR
Sinan Yılmaz,Sultaniye Mah. Doğan Araslı Blv. 350. Sk. No:1 Kat:5 İç Kapı No:70 Esenyurt 34510,TUR
Hasan İNAN,Yeni Mahalle Nalbant Caddesi No. 8/2 GEREDE 14900,TUR
O Medya Grup,Piri Paşa Mah. Fıstıklı Bahçe Sok. No:14 Beyoğlu Marmara 34100,TUR
Sinan Yılmaz,Sultaniye Mah. Doğan Araslı Blv. 350. Sk. No:1 İç Kapı No:70 Esenyurt 34510,TUR
SEHER ÇELİKKOL- ÇELİKKOL SİGORTA ARA.HİZ.,MERKEZ MAH.1 SOK. NO:1 D:8 GÖLCÜK /KOCAELİ TÜRKİYE 41000,TUR
Otorapor Araç Muayene ve Ekspetiz Hizmetleri Sanayi ve Ticaret A.Ş.,Küçük Çamlıca Mah. Libadiye Cad. No:76/A Marmara Bölgesi 34696,TUR
SMYDIŞ TİCARET LİMİTED ŞİRKETİ,"HAMİDİYE MAH. MENEKŞE SK. NO: 6 A İÇ KAPI NO: 1 ÇEKMEKÖY/ İSTANBUL, 6 D.NO:1 CEKMEKOY 34408",TUR
op.dr.ibrahim kasapoğlu,"ovacık mahallesi ankara caddesi no:18/4, Bağbaşı iş merkezi kat:2 no:4 Ankara caddesi 71990",TUR
MV OPTİONS ENERJİ ÖLÇME VE DOĞRULAMAMÜHENDİSLİK YAZILIM HİZMETLERİ,"Maslak Mh. Ahi Evran Cd., No:6 Maslak 42 Plaza D:546 Sarıyer 34485",TUR
EDNR DEMİR YANGIN KAPILARI,"Cevizlik mah. ebuziya cd., akhan no:1 BAKIRKÖY 34104",TUR
OFM Özçelik Özel Sağ. Hiz. Tic. San. A.Ş.,Eski Gazipaşa Caddesi No:3 Alanya 7460,TUR
Dr. Ali Rıza Öreroğlu,"Maçka Cd. No: 24/28 Narmanlı Apt. Teşvikiye, Nişantaşı Şişli 34367",TUR
Moda Turizm Seyahat Acentası,"Bağlarbaşı Mah. Bağdat Cad. Güven İş Merkezi No:415/61, Maltepe Maltepe 34959",TUR
ETG Express Kargo Turizm Bilişim İth. İhr. San. ve Tic. A.Ş.,Yenigöl Mah. Filiz Sok no: 79 Antalya 7260,TUR
Fors BilişiM yazılıM Donanım Otomasyon ve Arge Hiz San Tic Ltd Şti.,Yeni Mah Asik Veysel Bulvari Erciyes Universitesi Teknopark 4 Kat 2 No 60 Melikgazi 38130,TUR
Çağlar Helvacıoğlu,"BARBAROS MAHALLESİ UPHILL TOWERS, B Blok, KAT:28 Ataşehir 34750",TUR
Zülküf Kamer,"TÜRKALİ MAHALLESİ MISIRLIBAHÇE SOKAK NO:11/A BEŞİKTAŞ İSTANBUL, NO 11 / A BEŞİKTAŞ 34357",TUR
WimbleSoft,"Arabacıalanı Mah. 505.Sk. No:3/2, Özlem Evler 7.Blok A Girişi Daire 2 Serdivan 54050",TUR
300 K TEKNOLOJİ A.Ş.,"Çifte Havuzlar Mh. Eski Londra Asfaltı Cd., Kuluçka Mrk. A1 Blok No:151/1C İç Kapı No: B01 Esenler 34220",TUR
مشكاتي للتجارة,الرياض،التعاون،عثمان بن عفان ، 12476 الرياض 12476,SAU
موسسة زايد بن حمد بن هويمل للمقاولات,"الصداوى,الصدواى,الرياض الرياض 12788",SAU
ماهر عبود ابراهيم السالم,"العنوز , الخالديه, 2 الرياض 12874",SAU
مؤسسة مدينة التقنية للتسويق,جدة جدة 22242,SAU
مؤسسة أبواب الشرق,"شارع الملك خالد, الرياض الخرج 16271",SAU
مؤسسة على ناصر حسن جربين للمقاولات,البغداديه حي الشرفيه - جدة - السعودية جده 22235,SAU
مؤسسة الخير الصاعد للنقل البري,"مكة المكرمة, العزيزية مكة 21955",SAU
يحى ابراهيم عنبرى,الامير سلطان بن عبد العزيز ،حى الباديه الدمام 32243,SAU
شركة الراجح الحديثة للمقاولات المحدودة,كهرباء جده,SAU
مؤسسة كسوة قماش التجارية,"الأمام الشافعي الرياض (Riyadh, Saudi Arabia) 14224",SAU
شركة الاهرامات الاحترافية للتجارة شركة شخص واح,7817 سمرما، النزهة،3413 جدة 23534,SAU
مؤسسة ربط المتقدمة لتقنية المعلومات,"طريق الملك فهد فرعي ، حي مشرفة, عمارة مكة بلازا الدور الرابع مكتب رقم 10 جدة 23332",SAU
مؤسسة خطة الطيران للسفر والسياحة,الطائف الطائف 26511,SAU
مؤسسة مطلق مجرشى لتنجيد الاثاث,"وادى حنيفة, حى الدار البيضاء 7990 الرياض 14518",SAU
موسسة ركن المقباس للمقاولات,"ش مطاوى, الفيصليه الرياض 13223",SAU
مؤسسة ليلتي الذهبية للعبايات النسائيه,عمر ابن محمد النجاري الرياض 14233,SAU
شركة صالة الاطباء الطبي,الرياض حي الياسمين الرياض 11233,SAU
Bhr Solutions LLC,8533 Al Madinah Al Munawarah Jeddah 23442,SAU
مركز أوشن الرياضي,"طريق الملك عبدالعزيز, مقابل السد ابها 62521",SAU
مؤسسة دريم كول للتبريد والتكييف,ابو اسحاق الهجري، حي بئر عثمان المدينة المنورة 42331,SAU
مؤسسة العزل المعتمد للمقاولات,"الرياض العليا, الرياض الرياض 11461",SAU
مطابع لانا الوطنية للطباعة,"الفرزدق, البطحاء الرياض 11563",SAU
تيسير المسارات للدعايه والاعلان,"الرياض, 18 الرياض 12211",SAU
مؤسسة فجر نوافـ صناطح العنزي للتبريد والتكبيف,جدة جدة 22230,SAU
مؤسسة زجاجي للسيكوريت والمرايا,الصناعيه القديمه الرياض 12871,SAU
